{
  "$schema": "https://json-schema.org/draft/2020-12/schema",
  "type": "object",
  "additionalProperties": false,
  "properties": {
    "status": {
      "const": "success"
    },
    "provider": {
      "const": "http"
    },
    "http_status": {
      "type": "integer",
      "minimum": 100,
      "maximum": 599
    },
    "headers": {
      "type": "object",
      "additionalProperties": {
        "type": "string"
      }
    },
    "file": {
      "type": "object",
      "additionalProperties": false,
      "properties": {
        "path": {
          "type": "string",
          "pattern": "^workspace/resources/"
        },
        "content_hash": {
          "type": "string",
          "pattern": "^sha256:[a-f0-9]{64}$"
        },
        "size_bytes": {
          "type": "integer",
          "minimum": 0
        }
      },
      "required": [
        "path",
        "content_hash",
        "size_bytes"
      ]
    },
    "evidence_refs": {
      "type": "array",
      "minItems": 1,
      "items": {
        "type": "string",
        "pattern": "^ev_"
      }
    }
  },
  "required": [
    "status",
    "provider",
    "http_status",
    "headers",
    "file",
    "evidence_refs"
  ],
  "$id": "https://schemas.skillmind.local/tools/http.read/v1/response.schema.json",
  "title": "http.read/v1 response"
}
